{"status":{"code":0,"name":"OK"},"sigs":[{"seqno":6,"payload_hash":"dc2af89b293008f724d32fb016ba2a13e4c5e55cb90fe795aad4231423bbf65f","merkle_seqno":3999120,"sig_id":"ca0d936cfd7c1d59db092f95839cff8f7a43d6e329c5ad8c8a3744c7e9903e9d0f","sig_id_short":"yg2TbP18HVnbCS-Vg5z_j3pD1uMpxa2MijdE","kid":"0120a8a3b50326e520eee37eea6739a36a77315d02df0720fad9234dec3b9c4062d30a","sig":"hKRib2R5hqhkZXRhY2hlZMOpaGFzaF90eXBlCqNrZXnEIwEgqKO1AyblIO7jfupnOaNqdzFdAt8HIPrZI03sO5xAYtMKp3BheWxvYWTESpcCBsQgoi+YMrHYPrsuhABQ4+NKN7M9OyL/7ASt48C1DKzcvSHEIFfyYSdfj5OKy0XXdQpAyOn9A1Q5hzBourxt3faOAU0tAgHCo3NpZ8RADf25KfL2D10yG1END2TVElMkoFleLmc6qPaZPGQ9BIsWN/aggsrGKVlELgPM3hG0WEwG+XnVoKfPpZIG6KcuD6hzaWdfdHlwZSCkaGFzaIKkdHlwZQildmFsdWXEIIyrGbZqmiEkVG87af0GGzZW7z/WlK9xwO1tpe6wiH6qo3RhZ80CAqd2ZXJzaW9uAQ==","payload_json":"{\"body\":{\"key\":{\"eldest_kid\":\"0120a8a3b50326e520eee37eea6739a36a77315d02df0720fad9234dec3b9c4062d30a\",\"host\":\"keybase.io\",\"kid\":\"0120a8a3b50326e520eee37eea6739a36a77315d02df0720fad9234dec3b9c4062d30a\",\"uid\":\"9fbb585ab07c4f81f161f46a238ffa19\",\"username\":\"eysz7x_\"},\"merkle_root\":{\"ctime\":1543009193,\"hash\":\"a47d8ca8587d58f4a6eb4e76fbc5141ae1209a3f66d395aac3f314183cda004cf550274160522353ce7f8b527866117ca6cf9f994019838d16e9d4087177edb5\",\"hash_meta\":\"01ae2b8759d65ed648cd530068b2a31a25bf4f7d0d9ac07431bd5a5b664fb387\",\"seqno\":3999117},\"service\":{\"entropy\":\"4ONCd2bZvjXvkjPLNgY8jLa5\",\"name\":\"github\",\"username\":\"eysz7x\"},\"type\":\"web_service_binding\",\"version\":2},\"client\":{\"name\":\"keybase.io go client\",\"version\":\"2.10.1\"},\"ctime\":1543009209,\"expire_in\":504576000,\"prev\":\"a22f9832b1d83ebb2e840050e3e34a37b33d3b22ffec04ade3c0b50cacdcbd21\",\"seqno\":6,\"tag\":\"signature\"}","sig_type":2,"sig_version":2,"ctime":1543009209,"etime":2047585209,"rtime":null,"eldest_seqno":1,"sig_status":0,"prev":"a22f9832b1d83ebb2e840050e3e34a37b33d3b22ffec04ade3c0b50cacdcbd21","proof_id":"848b2583f60f50be8bb95d10","proof_type":3,"proof_text_check":"hKRib2R5hqhkZXRhY2hlZMOpaGFzaF90eXBlCqNrZXnEIwEgqKO1AyblIO7jfupnOaNqdzFdAt8HIPrZI03sO5xAYtMKp3BheWxvYWTESpcCBsQgoi+YMrHYPrsuhABQ4+NKN7M9OyL/7ASt48C1DKzcvSHEIFfyYSdfj5OKy0XXdQpAyOn9A1Q5hzBourxt3faOAU0tAgHCo3NpZ8RADf25KfL2D10yG1END2TVElMkoFleLmc6qPaZPGQ9BIsWN/aggsrGKVlELgPM3hG0WEwG+XnVoKfPpZIG6KcuD6hzaWdfdHlwZSCkaGFzaIKkdHlwZQildmFsdWXEIIyrGbZqmiEkVG87af0GGzZW7z/WlK9xwO1tpe6wiH6qo3RhZ80CAqd2ZXJzaW9uAQ==","proof_text_full":"### Keybase proof\n\nI hereby claim:\n\n  * I am eysz7x on github.\n  * I am eysz7x_ (https://keybase.io/eysz7x_) on keybase.\n  * I have a public key ASCoo7UDJuUg7uN-6mc5o2p3MV0C3wcg-tkjTew7nEBi0wo\n\nTo claim this, I am signing this object:\n\n```json\n{\n  \"body\": {\n    \"key\": {\n      \"eldest_kid\": \"0120a8a3b50326e520eee37eea6739a36a77315d02df0720fad9234dec3b9c4062d30a\",\n      \"host\": \"keybase.io\",\n      \"kid\": \"0120a8a3b50326e520eee37eea6739a36a77315d02df0720fad9234dec3b9c4062d30a\",\n      \"uid\": \"9fbb585ab07c4f81f161f46a238ffa19\",\n      \"username\": \"eysz7x_\"\n    },\n    \"merkle_root\": {\n      \"ctime\": 1543009193,\n      \"hash\": \"a47d8ca8587d58f4a6eb4e76fbc5141ae1209a3f66d395aac3f314183cda004cf550274160522353ce7f8b527866117ca6cf9f994019838d16e9d4087177edb5\",\n      \"hash_meta\": \"01ae2b8759d65ed648cd530068b2a31a25bf4f7d0d9ac07431bd5a5b664fb387\",\n      \"seqno\": 3999117\n    },\n    \"service\": {\n      \"entropy\": \"4ONCd2bZvjXvkjPLNgY8jLa5\",\n      \"name\": \"github\",\n      \"username\": \"eysz7x\"\n    },\n    \"type\": \"web_service_binding\",\n    \"version\": 2\n  },\n  \"client\": {\n    \"name\": \"keybase.io go client\",\n    \"version\": \"2.10.1\"\n  },\n  \"ctime\": 1543009209,\n  \"expire_in\": 504576000,\n  \"prev\": \"a22f9832b1d83ebb2e840050e3e34a37b33d3b22ffec04ade3c0b50cacdcbd21\",\n  \"seqno\": 6,\n  \"tag\": \"signature\"\n}\n```\n\nwith the key [ASCoo7UDJuUg7uN-6mc5o2p3MV0C3wcg-tkjTew7nEBi0wo](https://keybase.io/eysz7x_), yielding the signature:\n\n```\nhKRib2R5hqhkZXRhY2hlZMOpaGFzaF90eXBlCqNrZXnEIwEgqKO1AyblIO7jfupnOaNqdzFdAt8HIPrZI03sO5xAYtMKp3BheWxvYWTESpcCBsQgoi+YMrHYPrsuhABQ4+NKN7M9OyL/7ASt48C1DKzcvSHEIFfyYSdfj5OKy0XXdQpAyOn9A1Q5hzBourxt3faOAU0tAgHCo3NpZ8RADf25KfL2D10yG1END2TVElMkoFleLmc6qPaZPGQ9BIsWN/aggsrGKVlELgPM3hG0WEwG+XnVoKfPpZIG6KcuD6hzaWdfdHlwZSCkaGFzaIKkdHlwZQildmFsdWXEIIyrGbZqmiEkVG87af0GGzZW7z/WlK9xwO1tpe6wiH6qo3RhZ80CAqd2ZXJzaW9uAQ==\n\n```\n\nAnd finally, I am proving ownership of the github account by posting this as a gist.\n\n### My publicly-auditable identity:\n\nhttps://keybase.io/eysz7x_\n\n### From the command line:\n\nConsider the [keybase command line program](https://keybase.io/download).\n\n```bash\n# look me up\nkeybase id eysz7x_\n```\n","check_data_json":"{\"entropy\":\"4ONCd2bZvjXvkjPLNgY8jLa5\",\"name\":\"github\",\"username\":\"eysz7x\"}","remote_id":"","api_url":null,"human_url":null,"proof_state":3,"proof_status":201,"retry_count":4,"hard_fail_count":104,"last_check":1544061154,"last_success":null,"version":4,"is_eldest":0,"fingerprint":""}]}